A1: 1carat Diamond - | B1: 2000 | C1: =SUM(B:B)/564 -> 143534.50886524824 | D1: sum / 564
A2: 2carat Diamond - | B2: 15000 | C2: =SUM(B:B)/COUNT(B:B) -> 175985.78913043477 | D2: sum / count
A3: 3carat Diamond - | B3: 45000 | C3: =COUNT(B:B) -> 460 | D3: values entered
A4: Acorn - | B4: 49 | C4: =COUNTIF(B:B,">=3000000") -> 11 | D4: items worth >=3mil
A5: Adventurer's Suit - 0 | B5: 2000 | C5: =COUNTIF(B:B,">=1000000") -> 19 | D5: items worth >=1mil
A6: Adventurer's Suit - 1 | B6: 2000 | C6: =COUNTIF(B:B,">=250000") -> 39 | D6: items worth >=250k
A7: Aerial - 0 | B7: 1000000 | C7: =(((250000*564)-SUM(B:B))/(564-C3)) -> 577370.54807692312 | D7: av value of remaining for 250k
A8: Alchol - | B8: 4000 | D8: OBB is worth zero since it's / 564 instead of 565
A9: Aloe - | B9: 10000 | D9: so that assumes you re-use it.
A10: Aloe Leaflet - | B10: 5000
A11: Aloevera -
A12: Amethyst - | B12: 4000
A13: Amulet - | B13: 3000
A14: Ancient Lips - | B14: 274
A15: Ancient Tooth - | B15: 274
A16: Animal Gore -
A17: Animal Skin - | B17: 18
A18: Anodyne - | B18: 3000
A19: Ant Jaw - | B19: 116
A20: Antler - 0 | B20: 1100000
A21: Anvil -
A22: Apple - | B22: 7
A23: Apple Juice - | B23: 10
A24: Apple o' Archer - 0 | B24: 510000
A25: Aquamarine - | B25: 2500
A26: Arbalest - 1 | B26: 24000
A27: Arbalest - 2 | B27: 24000
A28: Arc Wand - 1 | B28: 35000
A29: Arc Wand - 2 | B29: 1000000
A30: Army Cap - 0 | B30: 1000000
A31: Axe - 3 | B31: 250
A32: Axe - 4 | B32: 250
A33: Ball'n'Chain - 0 | B33: 50000
A34: Banana - | B34: 7
A35: Banana Juice - | B35: 10
A36: Bandana - 0 | B36: 1000
A37: Baphomet Doll - | B37: 10000
A38: Bastard Sword - 2 | B38: 100000
A39: Bastard Sword - 3 | B39: 11250
A40: Battle Axe - 3 | B40: 5000
A41: Battle Axe - 4 | B41: 5000
A42: Bear's Footskin - | B42: 92
A43: Bee Sting - | B43: 16
A44: Bible - 0 | B44: 700000
A45: Big Ribbon - 0 | B45: 4000000
A46: Bill of Birds - | B46: 32
A47: Binoculars - 0
A48: Biretta - 0 | B48: 4500
A49: Biretta - 1 | B49: 150000
A50: Black Dyestuffs - | B50: 15000
A51: Black Hair - | B51: 146
A52: Black Ladle - | B52: 250
A53: Blade - 3 | B53: 1450
A54: Blade - 4 | B54: 1450
A55: Blinker - 0
A56: Blue Gemstone - | B56: 400
A57: Blue Hair - | B57: 171
A58: Blue Herb - | B58: 2
A59: Blue Potion - | B59: 3000
A60: Bomb Wick - 0 | B60: 200000
A61: Bone Helm - 0
A62: Bone Wand - 0 | B62: 4000000
A63: Book - 0
A64: Boots - 0 | B64: 9000
A65: Boots - 1 | B65: 110000
A66: Bouquet - | B66: 1000
A67: Bow - 3 | B67: 500
A68: Bow - 4 | B68: 500
A69: Boys Cap - 0
A70: Broad Sword - 1 | B70: 32500
A71: Broad Sword - 2 | B71: 32500
A72: Brooch - 0 | B72: 2500000
A73: Buckler - 0 | B73: 7000
A74: Buckler - 1 | B74: 20000
A75: Bug Leg - | B75: 215
A76: Bunny Band - 0 | B76: 700000
A77: Buster - 1 | B77: 17000
A78: Buster - 2 | B78: 17000
A79: Butterfly Wing - | B79: 250
A80: Cactus Needle - | B80: 41
A81: Candy -
A82: Candy Cane -
A83: Cap - 0 | B83: 6000
A84: Cap - 1 | B84: 6000
A85: Cape of Old Marquess - 0 | B85: 400000
A86: Carrot - | B86: 13
A87: Carrot Juice - | B87: 10
A88: Celebrant's Mitten - 0 | B88: 400000
A89: Chain - 2 | B89: 11500
A90: Chain - 3 | B90: 11500
A91: Chain Mail - 0 | B91: 50000
A92: Chain Mail - 1 | B92: 500000
A93: China - | B93: 500
A94: Chivalry Emblem -
A95: Chonchon Doll -
A96: Chrysalis - | B96: 4
A97: Chung Jah - | B97: 3000
A98: Cigar - 0 | B98: 210000
A99: Circlet - 0 | B99: 6500
A100: Circlet - 1 | B100: 200000
A101: Clam Flesh - | B101: 1
A102: Clam Shell - | B102: 1
A103: Claymore - 0 | B103: 37000
A104: Clip - 1 | B104: 6000000
A105: Clover - | B105: 5
A106: Club - 3 | B106: 60
A107: Club - 4 | B107: 60
A108: Coal -
A109: Coat - 0 | B109: 11000
A110: Coat - 1 | B110: 11000
A111: Cobaltblue Dyestuffs - | B111: 10000
A112: Cobweb -
A113: Composite Bow - 3 | B113: 1250
A114: Composite Bow - 4 | B114: 1250
A115: Conch - | B115: 79
A116: Coronet - 0 | B116: 3500000
A117: Corsair - 0 | B117: 5500000
A118: Cotton Shirts - 0 | B118: 5
A119: Cotton Shirts - 1 | B119: 5
A120: Counteragent - | B120: 100
A121: Cracked Diamond - | B121: 5
A122: Crap Shell -
A123: Cross Bow - 2 | B123: 8500
A124: Cross Bow - 3 | B124: 8500
A125: Crystal Blue -
A126: Crystal Mirror - | B126: 15000
A127: Crystal Pumps - 0 | B127: 1500000
A128: Cultish Masque - | B128: 1000
A129: Cursed Ruby - | B129: 14000
A130: Cute Ribbon - 0 | B130: 250
A131: Cutter - 3 | B131: 625
A132: Cutter - 4 | B132: 625
A133: Daenggie - | B133: 125
A134: Dagger - 2 | B134: 7000
A135: Dagger - 3 | B135: 7000
A136: Damascus - 1 | B136: 24500
A137: Damascus - 2 | B137: 24500
A138: Darkgreen Dyestuffs - | B138: 10000
A139: Dead Branch - | B139: 9000
A140: Dead Medusa - | B140: 274
A141: Decayed Nail - | B141: 41
A142: Detonator - | B142: 225
A143: Detrimindexta - | B143: 50
A144: Diamond Ring - 0 | B144: 22500
A145: Dirk - 2 | B145: 4250
A146: Dirk - 3 | B146: 4250
A147: Diver Goggles - 0 | B147: 9000
A148: Doctor Band - 0 | B148: 350000
A149: Dokkaebi Horn - | B149: 146
A150: Dragon Canine - | B150: 242
A151: Dragon Scale - | B151: 250
A152: Dragon Tail - | B152: 600
A153: Eagle Eyes - 0
A154: Ear Muffs - 0 | B154: 500000
A155: Earring - 0 | B155: 4000000
A156: Earthworm Peeling - | B156: 98
A157: Egg Shell - 0 | B157: 19000
A158: Elder Pixie's Moustache - | B158: 116
A159: Elunium - | B159: 200000
A160: Elven Ears - 0 | B160: 3000000
A161: Emerald - | B161: 2500
A162: Emperium - | B162: 160000
A163: Emperium Anvil - | B163: 6000000
A164: Empty Bottle - | B164: 2
A165: Emveretarcon -
A166: Evil Horn - | B166: 510
A167: Eye Patch - 0 | B167: 500
A168: Fabric - | B168: 153
A169: Falchion - 3 | B169: 750
A170: Falchion - 4 | B170: 750
A171: Fancy Flower - 0
A172: Fang - | B172: 340
A173: Feather - | B173: 10
A174: Feather Bonnet - 0
A175: Feather of Birds - | B175: 5
A176: Fin - | B176: 206
A177: Fin Helm - 0 | B177: 300000
A178: Fish Tail - | B178: 98
A179: Flail - 2 | B179: 8000
A180: Flail - 3 | B180: 8000
A181: Flamberge - 0 | B181: 30000
A182: Flame Heart - | B182: 60000
A183: Flower - | B183: 2
A184: Flower Ring - 0 | B184: 750
A185: Flu Mask - 0 | B185: 150
A186: Fluff - | B186: 4
A187: Fly Wing - | B187: 81
A188: Four Leaf Clover - | B188: 180000
A189: Frill - | B189: 125
A190: Frozen Rose - | B190: 17500
A191: Full Plate - 0 | B191: 37000
A192: Full Plate - 1
A193: Funeral Hat - 0
A194: Gakkung - 1 | B194: 21000
A195: Gakkung - 2 | B195: 21000
A196: Gangster Mask - 0
A197: Garlet - | B197: 20
A198: Garnet - | B198: 2500
A199: Gas Mask - | B199: 400000
A200: Geek Glasses - 0 | B200: 10000
A201: Gemmed Sallet - 0 | B201: 25000
A202: Gemmed Sallet - 1 | B202: 25000
A203: Ghost Bandana - 0
A204: Gill - | B204: 171
A205: Gladius - 2 | B205: 21500
A206: Gladius - 3 | B206: 21500
A207: Glaive - 2 | B207: 10000
A208: Glaive - 3 | B208: 10000
A209: Glass Bead - | B209: 750
A210: Glasses - 0 | B210: 2000
A211: Glasses - 1 | B211: 2000
A212: Glove - 0 | B212: 400000
A213: Goblini Mask -
A214: Goggles - 0 | B214: 35000
A215: Goggles - 1
A216: Gold -
A217: Gold Ring - 0 | B217: 15000
A218: Golden Anvil - | B218: 300000
A219: Golden Gear - 0
A220: Golden Hair - | B220: 215
A221: Golden Hammer -
A222: Grampa Beard - 0
A223: Grand Circlet - 0 | B223: 6000000
A224: Grape - | B224: 100
A225: Grape Juice - | B225: 750
A226: Grasshopper's Leg - | B226: 18
A227: Great Bow - 2 | B227: 5000
A228: Great Bow - 3 | B228: 5000
A229: Great Nature -
A230: Green Feeler - 0
A231: Green Herb - | B231: 5
A232: Green Live -
A233: Green Potion - | B233: 20
A234: Grit - | B234: 153
A235: Guard - 0 | B235: 250
A236: Guard - 1 | B236: 60000
A237: Guisarme - 2 | B237: 6500
A238: Guisarme - 3 | B238: 6500
A239: Haedonggum - 1 | B239: 25000
A240: Haedonggum - 2 | B240: 25000
A241: Hair Band - 0 | B241: 250
A242: Hallberd - 1 | B242: 27000
A243: Hallberd - 2 | B243: 27000
A244: Hammer - 2
A245: Hammer - 3
A246: Hammer of Blacksmith - | B246: 1
A247: Hand of God - | B247: 1
A248: Hat - 0 | B248: 500
A249: Hat - 1 | B249: 500
A250: Headset - 0
A251: Heart of Mermaid - | B251: 10
A252: Heaven Ring - 0 | B252: 300000
A253: Helm - 0 | B253: 22000
A254: Helm - 1 | B254: 22000
A255: Heroic Emblem - | B255: 1500
A256: Highheels - 0
A257: Hinalle -
A258: Hinalle Leaflet -
A259: Holy Water - | B259: 10
A260: Honey - | B260: 250
A261: Hood - 0 | B261: 500
A262: Hood - 1 | B262: 500
A263: Horn - | B263: 53
A264: Horrendous Hair - | B264: 400
A265: Horrendous Mouth - | B265: 195
A266: Horseshoe - | B266: 294
A267: Hunter Bow - 0 | B267: 32000
A268: Illusion Flower -
A269: Immortal Heart - | B269: 337
A270: Indian Fillet - 0
A271: Insect Feeler - | B271: 57
A272: Iron -
A273: Iron Cain - 0
A274: Iron Hammer -
A275: Iron Ore -
A276: Jack a Dandy - 0 | B276: 22500
A277: Jack o' Pumpkin - | B277: 187
A278: Jacket - 0 | B278: 100
A279: Jacket - 1 | B279: 100
A280: Jamadhar - 0 | B280: 18600
A281: Jamadhar - 1 | B281: 18600
A282: Javelin - 3 | B282: 75
A283: Javelin - 4 | B283: 75
A284: Jellopy - | B284: 3
A285: Jewel Crown - 0 | B285: 7000000
A286: Joker Jester - 0
A287: Jur - 2 | B287: 9750
A288: Jur - 3 | B288: 9750
A289: Kapra Band - 0
A290: Karvodailnirol - | B290: 50
A291: Katana - 3 | B291: 1000
A292: Katana - 4 | B292: 1000
A293: Katar - 1 | B293: 20500
A294: Katar - 2 | B294: 20500
A295: Kitty Band - 0
A296: Knife - 3 | B296: 25
A297: Knife - 4 | B297: 25
A298: Lance - 0 | B298: 30000
A299: Lantern - | B299: 125
A300: Lapier - 2
A301: Lapier - 3
A302: Lemon Dyestuffs -
A303: Little Evil Horn -
A304: Little Evil Wing - | B304: 1000
A305: Mace - 3 | B305: 800
A306: Mace - 4 | B306: 800
A307: Machoman's Glasses - 0
A308: Magnifier - | B308: 50
A309: Main Gauche - 3
A310: Main Gauche - 4
A311: Mane - | B311: 98
A312: Maneater Blossom - | B312: 98
A313: Maneater Root - | B313: 104
A314: Manteau - 0 | B314: 16000
A315: Manteau - 1 | B315: 16000
A316: Mantis Scythe - | B316: 98
A317: Mantle - 0
A318: Mantle - 1
A319: Masquerade - 0
A320: Mastela Fruit - | B320: 420
A321: Matyr's Leash - 0
A322: Meat - | B322: 27
A323: Memento - | B323: 150
A324: Ment -
A325: Mighty Staff - 0 | B325: 500000
A326: Milk - | B326: 12
A327: Mini Furnace -
A328: Mini Glasses - 0
A329: Mink Coat - 1
A330: Mirror Shield - 0 | B330: 30000
A331: Mirror Shield - 1 | B331: 30000
A332: Mixture - | B332: 100
A333: Mole Claw - | B333: 105
A334: Mole Whiskers - | B334: 53
A335: Monk Hat - 0
A336: Monster's Feed - | B336: 30
A337: Morning Star - 1 | B337: 20500
A338: Morning Star - 2 | B338: 20500
A339: Moth Dust - | B339: 69
A340: Moth Wings -
A341: Mr. Scream -
A342: Mr. Smile -
A343: Muffler - 0 | B343: 2500
A344: Muffler - 1 | B344: 30000
A345: Munak Hat - | B345: 300000
A346: Mushroom Spore - | B346: 18
A347: Mystic Frozen -
A348: Necklace - 0
A349: Necklace of Oblivion - | B349: 1
A350: Necklace of Wisdom - | B350: 1
A351: Nine Tails -
A352: Ninja Suit - 0 | B352: 400000
A353: Nipper - | B353: 57
A354: Nose Ring - | B354: 284
A355: Nurse Cap - 0 | B355: 120000
A356: Old Blue Box - | B356: 0
A357: Old Magicbook - | B357: 70000
A358: Opal - | B358: 2500
A359: Ora Ora - | B359: 500
A360: Orange Dyestuffs - | B360: 10000
A361: Orange Potion - | B361: 100
A362: Orc Claw - | B362: 84
A363: Orc Helm - 0
A364: Orcish Voucher - | B364: 84
A365: Orc's Fang - | B365: 110
A366: Oridecon - | B366: 200000
A367: Oridecon Anvil -
A368: Oridecon Hammer -
A369: Osiris Doll - | B369: 3000
A370: Oxygen Mask - 0
A371: Padded Armor - 0 | B371: 24000
A372: Padded Armor - 1 | B372: 24000
A373: Panacea - | B373: 250
A374: Pantie - 0
A375: Partizan - 1 | B375: 13500
A376: Partizan - 2 | B376: 13500
A377: Pearl - | B377: 2500
A378: Pencil Case - | B378: 150
A379: Ph.D Hat - 0 | B379: 400000
A380: Phantom of Opera - | B380: 35000
A381: Phracon - | B381: 100
A382: Pierrot Nose - 0 | B382: 10000
A383: Pike - 3 | B383: 1725
A384: Pike - 4 | B384: 1725
A385: Pipe - 0 | B385: 2000000
A386: Pirate Bandana - 0
A387: Pointed Scale - | B387: 35
A388: Poo Poo Hat - 0
A389: Porcupine Quill - | B389: 274
A390: Poring Doll - | B390: 500
A391: Powder of Butterfly - | B391: 45
A392: Pretend Murdered - 0
A393: Pumkin -
A394: Puppet - | B394: 1500
A395: Puppy Love - 0
A396: Purple Glasses - 0 | B396: 12000
A397: Raccoon Leaf -
A398: Racoon Doll -
A399: Ragamuffin Manteau - 0
A400: Rainbow Shell - | B400: 45
A401: Rat Tail - | B401: 26
A402: Red Bandana - 0
A403: Red Blood -
A404: Red Frame - | B404: 1500
A405: Red Gemstone - | B405: 350
A406: Red Herb - | B406: 9
A407: Red Potion - | B407: 41
A408: Reins - | B408: 401
A409: Reptile Tongue - | B409: 25
A410: Resin - | B410: 64
A411: Ribbon - 0 | B411: 400
A412: Ribbon - 1 | B412: 400
A413: Ring - 0
A414: Ring Pommel Saber - 2 | B414: 12000
A415: Ring Pommel Saber - 3 | B415: 12000
A416: Rocker Doll - | B416: 2000
A417: Rod - 3 | B417: 25
A418: Rod - 4 | B418: 25
A419: Roguemaster's Bow - 0
A420: Romantic Flower - 0
A421: Romantic Gent - 0
A422: Romantic Leaf - 0
A423: Rosary - 0 | B423: 7500
A424: Rotten Bandage - | B424: 179
A425: Rough Elunium - | B425: 40000
A426: Rough Oridecon - | B426: 40000
A427: Rough Wind - | B427: 200000
A428: Royal Jelly - | B428: 3500
A429: Ruby - | B429: 2500
A430: Saber - 2
A431: Saber - 3
A432: Safety Helmet - 0
A433: Saint's Robe - 0 | B433: 27000
A434: Saint's Robe - 1 | B434: 27000
A435: Sakkat - 0 | B435: 200000
A436: Sandals - 0 | B436: 200
A437: Sandals - 1 | B437: 200
A438: Santa Hat - 0
A439: Sapphire - | B439: 2500
A440: Sardonyx - | B440: 2500
A441: Scale Shell - | B441: 233
A442: Scapulare - 0 | B442: 3250
A443: Scapulare - 1 | B443: 3250
A444: Scarlet Dyestuffs - | B444: 10000
A445: Scell - | B445: 80
A446: Scimiter - 2 | B446: 8500
A447: Scimiter - 3 | B447: 8500
A448: Scorpion Nipper - | B448: 307
A449: Scorpion Tail - | B449: 84
A450: Sharp scale - | B450: 125
A451: Shell - | B451: 6
A452: Shield - 0 | B452: 28000
A453: Shield - 1 | B453: 28000
A454: Shining Scale - | B454: 92
A455: Shoes - 0 | B455: 1750
A456: Shoes - 1 | B456: 1750
A457: Shoot -
A458: Silk Robe - 0 | B458: 4000
A459: Silk Robe - 1 | B459: 4000
A460: Silver Ring - 0 | B460: 10000
A461: Silver Robe - 0 | B461: 3500
A462: Silver Robe - 1 | B462: 3500
A463: Singing Plant -
A464: Single Cell - | B464: 23
A465: Single Glass - 0
A466: Skel-Bone - | B466: 116
A467: Skirt of Virgin - | B467: 850
A468: Skull Ring - 0 | B468: 5000
A469: Slayer - 2 | B469: 7500
A470: Slayer - 3 | B470: 7500
A471: Smasher - 2 | B471: 4500
A472: Smasher - 3 | B472: 4500
A473: Snail's Shell - | B473: 32
A474: Snake Scale - | B474: 41
A475: Snow Horn - 0 | B475: 130000
A476: Solid Shell - | B476: 224
A477: Spawn - | B477: 74
A478: Spear - 3 | B478: 850
A479: Spear - 4 | B479: 850
A480: Spiky Band - 0
A481: Spore Doll - | B481: 2500
A482: Squid Ink - | B482: 132
A483: Staff - 2 | B483: 4750
A484: Staff - 3 | B484: 4750
A485: Star Crumb - | B485: 50000
A486: Star Dust - | B486: 4000
A487: Steel - | B487: 12000
A488: Stellar - 0 | B488: 400000
A489: Stem - | B489: 29
A490: Sticky Mucus -
A491: Sticky Webfoot - | B491: 10
A492: Stiletto - 2 | B492: 9750
A493: Stiletto - 3 | B493: 9750
A494: Stinky Scale - | B494: 84
A495: Stone Heart - | B495: 92
A496: Stop Post - 0 | B496: 150000
A497: Sunflower - 0
A498: Sunglasses - 0 | B498: 6000
A499: Sunglasses - 1 | B499: 6000000
A500: Sweet Gent - 0
A501: Sweet Potato - | B501: 7
A502: Sword - 3 | B502: 50
A503: Sword - 4 | B503: 50
A504: Sword Mace - 0 | B504: 25000
A505: Sword Mace - 1 | B505: 25000
A506: Tablet - 0
A507: Talon - | B507: 10
A508: Tendon - | B508: 110
A509: Tentacle - | B509: 35
A510: Thief Clothes - 0 | B510: 37000
A511: Thief Clothes - 1 | B511: 37000
A512: Tiger Skin - | B512: 274
A513: Tiger's Footskin - | B513: 750
A514: Tights - 0 | B514: 35500
A515: Tights - 1 | B515: 400000
A516: Tongue - | B516: 264
A517: Tooth of Bat - | B517: 16
A518: Topaz - | B518: 2500
A519: Trap - | B519: 50
A520: Tree Root - | B520: 6
A521: Trident - 2 | B521: 25500
A522: Trident - 3 | B522: 25500
A523: Trunk - | B523: 1000
A524: Tsurugi - 1 | B524: 25500
A525: Tsurugi - 2 | B525: 25500
A526: Turban - 0 | B526: 2250
A527: Turban - 1 | B527: 2250
A528: Turtle Shell - | B528: 1
A529: Two-handed Axe - 1 | B529: 27500
A530: Two-handed Axe - 2 | B530: 27500
A531: Two-handed Sword - 1 | B531: 30000
A532: Two-handed Sword - 2 | B532: 30000
A533: Venom Canine - | B533: 79
A534: Violet Dyestuffs - | B534: 10000
A535: Wand - 2 | B535: 1250
A536: Wand - 3 | B536: 1250
A537: Wand of Occult - 0 | B537: 200000
A538: Wedding Bouquet - | B538: 5000
A539: Wedding Dress - 0 | B539: 22500
A540: Wedding Veil - 0 | B540: 11500
A541: Welding Mask - | B541: 400000
A542: Western Grace - 0
A543: White Dyestuffs - | B543: 10000
A544: White Herb - | B544: 60
A545: White Potion - | B545: 600
A546: Wind of Verdure - | B546: 12000
A547: Witched Starsand - | B547: 125
A548: Witherless Rose - | B548: 25000
A549: Wizard Hat - 0 | B549: 1500000
A550: Wolf Claw - | B550: 29
A551: Wooden Mail - 0 | B551: 2750
A552: Wooden Mail - 1 | B552: 2750
A553: Worm Peeling - | B553: 26
A554: Yellow Gemstone - | B554: 300
A555: Yellow Herb - | B555: 20
A556: Yellow potion - | B556: 275
A557: Yggdrasil Leaf - | B557: 1850
A558: Yggdrasil Seed -
A559: Yggdrasilberry -
A560: Yoyo Doll - | B560: 3500
A561: Yoyo Tail - | B561: 57
A562: Zargon - | B562: 250
A563: Zenorc's Fang - | B563: 132
A564: Zircon - | B564: 2500
A565: Zoro Masque - 0 | B565: 150000