A1: Tyan Tiger K7 | B1: 215
A2: Athlon MP 1800 | B2: 190
A3: 3Ware Escalade 7810 - up to 8 drives | B3: 450
A4: 3Ware Escalade 7410 - up to 4 drives | C4: 330
A5: 512MB registered ram | B5: 115
A6: Case/400W power: | B6: 275
A7: Video card | B7: 50
A8: Misc | B8: 50
A9: 275
A10: IBM Deskstar 120GXP | B10: 3 | C10: 4 | D10: 5 | E10: 6 | F10: 7 | G10: 8
A11: Total RAID5 Capacity | B11: =(B$10-1)*120 -> 240 | C11: =(C$10-1)*120 -> 360 | D11: =(D$10-1)*120 -> 480 | E11: =(E$10-1)*120 -> 600 | F11: =(F$10-1)*120 -> 720 | G11: =(G$10-1)*120 -> 840
A12: Price | B12: =B$10*$A$9 -> 825 | C12: =C$10*$A$9 -> 1100 | D12: =D$10*$A$9 -> 1375 | E12: =E$10*$A$9 -> 1650 | F12: =F$10*$A$9 -> 1925 | G12: =G$10*$A$9 -> 2200
A13: Total price | B13: =B12+SUM($B$1:$B$2)+SUM($B$5:$B$8)+$C$4 -> 2050 | C13: =C12+SUM($B$1:$B$2)+SUM($B$5:$B$8)+$C$4 -> 2325 | D13: =D12+SUM($B$1:$B$8) -> 2720 | E13: =E12+SUM($B$1:$B$8) -> 2995 | F13: =F12+SUM($B$1:$B$8) -> 3270 | G13: =G12+SUM($B$1:$B$8) -> 3545
A15: Drive count/capacity is not easily upgradable
A16: Upgradable to dual processors at any time
A17: Upgrade ram at any time